{
  "$schema": "https://json-schema.org/draft/2020-12/schema",
  "$id": "https://github.com/matrakalaka/codex-project-bootstrap/contracts/human_approval.v0.schema.json",
  "title": "Human Approval v0",
  "type": "object",
  "additionalProperties": false,
  "required": ["schema_version", "approval_id", "correlation_id", "task_id", "assessment_id", "assessment_hash", "repository_identity", "authorized_head", "objective_hash", "allowed_paths", "forbidden_paths", "approved", "approver", "approved_at", "reason", "approval_sequence"],
  "properties": {
    "schema_version": {"const": "human_approval.v0"},
    "approval_id": {"type": "string", "minLength": 1}, "correlation_id": {"type": "string", "minLength": 1}, "task_id": {"type": "string", "minLength": 1}, "assessment_id": {"type": "string", "minLength": 1},
    "assessment_hash": {"type": "string", "pattern": "^sha256:[0-9a-f]{64}$"}, "repository_identity": {"type": "string", "minLength": 1}, "authorized_head": {"type": "string", "pattern": "^[0-9a-fA-F]{40}$"}, "objective_hash": {"type": "string", "pattern": "^sha256:[0-9a-f]{64}$"},
    "allowed_paths": {"type": "array", "items": {"type": "string"}}, "forbidden_paths": {"type": "array", "items": {"type": "string"}}, "approved": {"const": true},
    "approver": {"type": "object", "additionalProperties": false, "required": ["type", "identifier"], "properties": {"type": {"const": "HUMAN"}, "identifier": {"type": "string", "minLength": 1}}},
    "approved_at": {"type": "string", "minLength": 1}, "reason": {"type": "string", "minLength": 1}, "approval_sequence": {"type": "integer", "minimum": 1},
    "playbook_binding": {"type": "object", "additionalProperties": false, "required": ["canonical_playbook_fingerprint", "effective_playbook_fingerprint", "effective_parameters_hash"], "properties": {"canonical_playbook_fingerprint": {"type": "string", "pattern": "^sha256:[0-9a-f]{64}$"}, "effective_playbook_fingerprint": {"type": "string", "pattern": "^sha256:[0-9a-f]{64}$"}, "effective_parameters_hash": {"type": "string", "pattern": "^sha256:[0-9a-f]{64}$"}}}
  }
}
